{
  "$schema": "https://json-schema.org/draft/2020-12/schema",
  "type": "object",
  "additionalProperties": false,
  "required": ["schemaVersion", "toolchainId", "upstream", "buildImage", "actions", "targets"],
  "properties": {
    "schemaVersion": { "const": 1 },
    "toolchainId": { "const": "openopc-cosign-v3.1.2.1" },
    "upstream": {
      "type": "object",
      "additionalProperties": false,
      "required": ["repository", "tag", "tagObjectSha", "commitSha", "treeSha", "goVersion"],
      "properties": {
        "repository": { "const": "sigstore/cosign" },
        "tag": { "const": "v3.1.2" },
        "tagObjectSha": { "const": "dc80df70da727f4abdd843640594025584a270ae" },
        "commitSha": { "const": "193d2153431f8bb0d945a4c1ee721872f73add67" },
        "treeSha": { "const": "6647db468973d11edb5e737293fcf4b05c69a84a" },
        "goVersion": { "const": "1.26.0" }
      }
    },
    "buildImage": {
      "type": "object",
      "additionalProperties": false,
      "required": ["reference", "digest"],
      "properties": {
        "reference": { "const": "golang:1.26.0-bookworm" },
        "digest": { "type": "string", "pattern": "^sha256:(?!0{64}$)[a-f0-9]{64}$" }
      }
    },
    "actions": {
      "type": "object",
      "additionalProperties": false,
      "required": ["checkout", "uploadArtifact", "downloadArtifact", "attest", "setupBun"],
      "properties": {
        "checkout": { "const": "3d3c42e5aac5ba805825da76410c181273ba90b1" },
        "uploadArtifact": { "const": "043fb46d1a93c77aae656e7c1c64a875d1fc6a0a" },
        "downloadArtifact": { "const": "3e5f45b2cfb9172054b4087a40e8e0b5a5461e7c" },
        "attest": { "const": "508db95dd578ae2727ebd6217d5ba78e4fbda05d" },
        "setupBun": { "const": "0c5077e51419868618aeaa5fe8019c62421857d6" }
      }
    },
    "targets": { "const": ["linuxAmd64", "windowsAmd64"] }
  }
}
