{
  "schemaVersion": 1,
  "toolchainId": "openopc-cosign-v3.1.2.1",
  "upstream": {
    "repository": "sigstore/cosign",
    "tag": "v3.1.2",
    "tagObjectSha": "dc80df70da727f4abdd843640594025584a270ae",
    "commitSha": "193d2153431f8bb0d945a4c1ee721872f73add67",
    "treeSha": "6647db468973d11edb5e737293fcf4b05c69a84a",
    "goVersion": "1.26.0"
  },
  "buildImage": {
    "reference": "golang:1.26.0-bookworm",
    "digest": "sha256:1111111111111111111111111111111111111111111111111111111111111111"
  },
  "actions": {
    "checkout": "3d3c42e5aac5ba805825da76410c181273ba90b1",
    "uploadArtifact": "043fb46d1a93c77aae656e7c1c64a875d1fc6a0a",
    "downloadArtifact": "3e5f45b2cfb9172054b4087a40e8e0b5a5461e7c",
    "attest": "508db95dd578ae2727ebd6217d5ba78e4fbda05d",
    "setupBun": "0c5077e51419868618aeaa5fe8019c62421857d6"
  },
  "targets": ["linuxAmd64", "windowsAmd64"]
}
